<?xml version="1.0" encoding="UTF-8"?>
<xsd:schema xmlns:xsd="http://www.w3.org/2001/XMLSchema">

	<xsd:element name="categorie">
		<xsd:complexType>
			<xsd:sequence>
				<xsd:element ref="categoria" minOccurs="0" maxOccurs="unbounded" />
			</xsd:sequence>
			<xsd:attribute name="ultimo_id" type="xsd:integer" />
		</xsd:complexType>
	</xsd:element>

	<xsd:element name="categoria">
		<xsd:complexType>
			<xsd:sequence>
				<xsd:element ref="nomeCategoria" minOccurs="1" maxOccurs="1" />
			</xsd:sequence>
			<xsd:attribute name="id" type="xsd:positiveInteger" />
		</xsd:complexType>
	</xsd:element>

	<xsd:element name="nomeCategoria" type="xsd:string" />

</xsd:schema>